{
  "schema_version": "1.0",
  "problem_summary": "После изменения сетевых настроек приложение не подключалось к сервису.",
  "solution_summary": "Восстановлены подтвержденные настройки прокси для данной версии приложения.",
  "outcome": "resolved",
  "steps": [
    {
      "action": "Сотрудник указал правильные параметры прокси; клиент подтвердил их применение.",
      "evidence_message_ids": [
        "msg_staff_12",
        "msg_client_13"
      ]
    }
  ],
  "observed_result": "Клиент сообщил, что соединение восстановлено.",
  "evidence_message_ids": [
    "msg_client_1",
    "msg_staff_12",
    "msg_client_13"
  ],
  "applicability": [
    "Только для версии приложения и сетевой среды, указанных в исходном обращении"
  ],
  "cautions": [
    "Не переносить параметры прокси в другую организацию"
  ],
  "uncertainties": []
}
